{"apiVersion":"greentic.ai/v1","capabilities":{"offered":[{"id":"greentic:bundle/standard","version":"0.1.0"}],"required":[]},"contributions":{"recipes":[{"configSchema":"schemas/standard.config.schema.json","description":"Package designer session into a .gtpack archive","displayName":"Standard Greentic Pack","id":"standard","supportedCapabilities":["greentic:adaptive-cards/*","greentic:flows/*","greentic:channels/*"]}]},"engine":{"extRuntime":"^0.1.0","greenticDesigner":">=0.6.0"},"execution":{"kind":"wasm"},"kind":"BundleExtension","metadata":{"author":{"name":"Greentic"},"icon":"assets/icon.svg","id":"greentic.bundle-standard","license":"MIT","name":"Standard Bundle Recipe","summary":"Package designer session into a Greentic pack (.gtpack ZIP)","version":"1.2.3"},"runtime":{"component":"extension.wasm","memoryLimitMB":128,"permissions":{"callExtensionKinds":[],"network":[],"secrets":[]}},"signature":{"algorithm":"ed25519","publicKey":"66L1j2dtYwoRQ2R6Bt8qkshdZmdb2IW8lLRgibxAI60=","value":"B1Hn/Wt0ELbAmtXIB6uCynJ/C1e0pBtGzpP01IyVYBoSRGclcEFlsXCGaZByhsRGB4vMCdm5KKapX2nmI5qqDQ=="}}