{"apiVersion":"greentic.ai/v1","capabilities":{"offered":[{"id":"greentic:messaging/teams-personal","version":"0.1.0"},{"id":"greentic:messaging/teams-channel","version":"0.1.0"}],"required":[]},"contributions":{},"engine":{"extRuntime":"^0.1.0","greenticDesigner":"*"},"kind":"ProviderExtension","metadata":{"author":{"email":"team@greentic.ai","name":"Greentic"},"description":"Microsoft Teams via Bot Framework — Personal 1:1 chat and Team Channel posts with native Adaptive Cards","icon":"assets/icon.svg","id":"greentic.provider.teams","keywords":["messaging","teams","microsoft","bot-framework","adaptive-cards"],"license":"MIT","name":"Microsoft Teams","summary":"Microsoft Teams messaging provider via Bot Framework (Personal + Channel)","version":"1.2.3"},"runtime":{"component":"extension.wasm","gtpack":{"component_version":"0.6.0","file":"runtime/provider.gtpack","pack_id":"greentic.provider.teams","sha256":"d8f478fcaeea86ae2b202c91e30bc6fd622d1225f4ad953d48a5de04a092b45c"},"memoryLimitMB":32,"permissions":{"callExtensionKinds":[],"network":[],"secrets":[]}},"signature":{"algorithm":"ed25519","publicKey":"66L1j2dtYwoRQ2R6Bt8qkshdZmdb2IW8lLRgibxAI60=","value":"UeVgdmHtSyRf3Yk4cMN6aPXM93U5j5JsTKukyY0jWanV/7oip9RBX5wpzRhC9yh6lJ86urNkH2TZBXBD7Wv6Dg=="}}