{"apiVersion":"greentic.ai/v1","capabilities":{"offered":[{"id":"greentic:llm-openai/node","version":"0.1.0"}],"required":[]},"contributions":{"nodeTypes":[{"category":"ai","color":"#0d9488","complexity":"complex","config_schema":"{\"$schema\":\"https://json-schema.org/draft/2020-12/schema\",\"type\":\"object\",\"required\":[\"provider\",\"model\"],\"properties\":{\"provider\":{\"type\":\"string\",\"enum\":[\"openai\",\"ollama\",\"openrouter\",\"together\",\"custom\"],\"default\":\"openai\",\"description\":\"Backend LLM provider\"},\"api_key_secret\":{\"type\":\"string\",\"description\":\"Secret name for the API key (e.g. openai_api_key). Required for openai/openrouter/together; optional for ollama/custom.\",\"examples\":[\"openai_api_key\"]},\"base_url\":{\"type\":\"string\",\"format\":\"uri\",\"description\":\"Override base URL. Required when provider=custom.\"},\"model\":{\"type\":\"string\",\"description\":\"Model name (e.g. gpt-4o, llama3:8b).\",\"examples\":[\"gpt-4o\",\"gpt-4o-mini\",\"llama3:8b\"]},\"messages\":{\"type\":\"array\",\"items\":{\"type\":\"object\",\"required\":[\"role\",\"content\"],\"properties\":{\"role\":{\"type\":\"string\",\"enum\":[\"system\",\"user\",\"assistant\"]},\"content\":{\"type\":\"string\"}}}},\"prompt\":{\"type\":\"string\",\"description\":\"Single-turn shortcut. Mutually exclusive with messages.\"},\"system_prompt\":{\"type\":\"string\"},\"temperature\":{\"type\":\"number\",\"minimum\":0,\"maximum\":2,\"default\":1},\"top_p\":{\"type\":\"number\",\"minimum\":0,\"maximum\":1},\"max_tokens\":{\"type\":\"integer\",\"minimum\":1},\"timeout_ms\":{\"type\":\"integer\",\"minimum\":100,\"default\":30000},\"extra\":{\"type\":\"object\",\"description\":\"Passthrough to provider. Core fields are protected by the runtime.\"}},\"allOf\":[{\"if\":{\"properties\":{\"provider\":{\"const\":\"custom\"}},\"required\":[\"provider\"]},\"then\":{\"required\":[\"base_url\"]}},{\"oneOf\":[{\"required\":[\"messages\"]},{\"required\":[\"prompt\"]}]}]}","icon":"robot","label":"LLM OpenAI","output_ports":[{"label":"Success","name":"success"},{"label":"Error","name":"error"}],"type_id":"llm-openai"}],"prompts":["prompts/llm-openai-rules.md"],"tools":[{"export":"greentic:extension-design/tools.invoke-tool","name":"test_prompt"},{"export":"greentic:extension-design/tools.invoke-tool","name":"validate_messages"}]},"engine":{"extRuntime":"^0.3.0","greenticDesigner":">=0.6.0"},"kind":"DesignExtension","metadata":{"author":{"email":"team@greentic.ai","name":"Greentic AI"},"id":"greentic.llm-openai","license":"Apache-2.0","name":"LLM OpenAI (and compatible)","summary":"Connect flows to OpenAI, Ollama, OpenRouter, Together, and custom OpenAI-compatible endpoints.","version":"1.2.0"},"runtime":{"component":"extension.wasm","gtpack":{"component_version":"0.6.0","file":"runtime/component-llm-openai.gtpack","pack_id":"greentic.llm-openai","sha256":"5fa3b2730e024db29bfde9eac2e8fd8340d8385372573604710caa2bb3e7525a"},"memoryLimitMB":32,"permissions":{"callExtensionKinds":[],"network":["https://api.openai.com","https://openrouter.ai","https://api.together.xyz"],"secrets":["*"]}},"signature":{"algorithm":"ed25519","publicKey":"66L1j2dtYwoRQ2R6Bt8qkshdZmdb2IW8lLRgibxAI60=","value":"8lImDsBYIr0PWZMNgfDicJf/vf1RUjmNFRIBMGgn3vl4kGSfPbIcE7TnnLdgzhZ9LnyrULKPY7p/65DOEKx6AQ=="}}