{"apiVersion":"greentic.ai/v1","capabilities":{"offered":[{"id":"greentic:messaging/webex-room","version":"0.1.0"},{"id":"greentic:messaging/webex-direct","version":"0.1.0"}],"required":[]},"contributions":{},"engine":{"extRuntime":"^0.1.0","greenticDesigner":"*"},"kind":"ProviderExtension","metadata":{"author":{"email":"team@greentic.ai","name":"Greentic"},"description":"Cisco Webex Messaging — supports Room (group space) and 1:1 Direct messages with native Adaptive Cards","icon":"assets/icon.svg","id":"greentic.provider.webex","keywords":["messaging","webex","cisco","adaptive-cards"],"license":"MIT","name":"Webex","summary":"Cisco Webex Messaging provider (Rooms + Direct messages)","version":"1.2.3"},"runtime":{"component":"extension.wasm","gtpack":{"component_version":"0.6.0","file":"runtime/provider.gtpack","pack_id":"greentic.provider.webex","sha256":"a1a7e5785f8a5ec4917052a903a13ee4aa64dd21ae44335f4f24cd14619a2892"},"memoryLimitMB":32,"permissions":{"callExtensionKinds":[],"network":[],"secrets":[]}},"signature":{"algorithm":"ed25519","publicKey":"66L1j2dtYwoRQ2R6Bt8qkshdZmdb2IW8lLRgibxAI60=","value":"oHOvEhcL96HTYw5y1D3BYQbm8fApcfWvpYiFmjzBsXMjIA2y42eFGJSGzxhGrZV52gClyphyfj3VB1+bjqivAA=="}}