{"$schema":"https://store.greentic.ai/schemas/describe-v1.json","apiVersion":"greentic.ai/v1","capabilities":{"offered":[{"id":"greentic:http/node-generator","version":"1.0.0"},{"id":"greentic:http/validate","version":"1.0.0"},{"id":"greentic:http/curl-import","version":"1.0.0"}],"required":[]},"contributions":{"nodeTypes":[{"category":"integration","color":"#7c3aed","complexity":"simple","config_schema":{"properties":{"body_mapping":{"additionalProperties":{"type":"string"},"type":"object"},"headers":{"additionalProperties":{"type":"string"},"type":"object"},"method":{"enum":["GET","POST","PUT","PATCH","DELETE"],"type":"string"},"url":{"description":"Request URL","type":"string"}},"required":["url","method"],"type":"object"},"icon":"🌐","label":"HTTP Request","output_ports":[{"label":"Success","name":"success"},{"label":"Error","name":"error"}],"type_id":"http"}],"prompts":["prompts/rules.md","prompts/examples.md"],"schemas":["schemas/http-node-v1.json"],"tools":[{"export":"greentic:extension-design/tools.invoke-tool","name":"generate_http_node"},{"export":"greentic:extension-design/validation.validate-content","name":"validate_http_config"},{"export":"greentic:extension-design/tools.invoke-tool","name":"curl_to_node"},{"export":"greentic:extension-design/tools.invoke-tool","name":"suggest_auth"},{"export":"greentic:extension-design/tools.invoke-tool","name":"generate_from_card_submit"}]},"engine":{"extRuntime":"^0.1.0","greenticDesigner":">=0.6.0"},"kind":"DesignExtension","metadata":{"author":{"email":"team@greentic.ai","name":"Greentic"},"description":"Teaches the Designer LLM to generate YGTc HTTP nodes from natural language, curl commands, or card submit contexts. Wraps component-http runtime — does not make HTTP calls itself.","icon":"assets/icon.svg","id":"greentic.http","keywords":["http","api","rest","curl","design-extension"],"license":"MIT","name":"HTTP Client","repository":"https://github.com/greenticai/components-public","summary":"Generate and validate HTTP call nodes for Greentic flows","version":"1.2.0"},"runtime":{"component":"extension.wasm","memoryLimitMB":32,"permissions":{"callExtensionKinds":[],"network":[],"secrets":[]}},"signature":{"algorithm":"ed25519","publicKey":"66L1j2dtYwoRQ2R6Bt8qkshdZmdb2IW8lLRgibxAI60=","value":"B2fF6HUvaVy/l0wiwVVJl/Tc8cfUiWjvnZKtXiITd39JbW0RMMPRzGiFbRInOx80atwPr1uU8h3mG9ww6hk7BQ=="}}