{"apiVersion":"greentic.ai/v1","capabilities":{"offered":[{"id":"greentic:deploy/desktop-docker-compose","version":"0.2.0"},{"id":"greentic:deploy/desktop-podman","version":"0.2.0"}],"required":[]},"contributions":{"targets":[{"description":"Run on local Docker engine via docker-compose","displayName":"Local Docker Compose","execution":{"backend":"desktop","handler":"docker-compose","kind":"builtin"},"iconPath":"assets/docker.svg","id":"docker-compose-local","supportsRollback":true},{"description":"Run on local Podman engine via pods","displayName":"Local Podman","execution":{"backend":"desktop","handler":"podman","kind":"builtin"},"id":"podman-local","supportsRollback":true}]},"engine":{"extRuntime":"^0.1.0","greenticDesigner":"*"},"kind":"DeployExtension","metadata":{"author":{"email":"team@greentic.ai","name":"Greentic"},"icon":"assets/icon.svg","id":"greentic.deploy-desktop","license":"MIT","name":"Desktop Deploy","summary":"Local docker-compose and podman deployment targets","version":"1.2.0"},"runtime":{"component":"extension.wasm","memoryLimitMB":32,"permissions":{"callExtensionKinds":[],"network":[],"secrets":[]}},"signature":{"algorithm":"ed25519","publicKey":"66L1j2dtYwoRQ2R6Bt8qkshdZmdb2IW8lLRgibxAI60=","value":"C9DozprHtHqJ9Mkj7pCi+mfnGyWz6nKENzTJCjyI3w8Vj6KRt6y2x2fQ7dqba1/njnfwMMx+yBvf73e1EY1sDA=="}}