{"$schema":"https://store.greentic.ai/schemas/describe-v1.json","apiVersion":"greentic.ai/v1","capabilities":{"offered":[{"id":"greentic:webhook/trigger-spec","version":"1.0.0"},{"id":"greentic:webhook/validate","version":"1.0.0"},{"id":"greentic:webhook/path-suggester","version":"1.0.0"},{"id":"greentic:webhook/curl-import","version":"1.0.0"}],"required":[]},"contributions":{"nodeTypes":[{"category":"trigger","color":"#0ea5e9","complexity":"simple","config_schema":{"properties":{"allowed_sources":{"description":"Optional CIDR allowlist for the request's source IP (e.g. \"203.0.113.0/24\")","items":{"type":"string"},"type":"array"},"auth":{"description":"Authentication policy applied to incoming requests","properties":{"secret_ref":{"description":"Secret name holding the auth credential (for bearer / hmac / basic)","type":"string"},"type":{"default":"none","enum":["none","bearer","hmac","basic"],"type":"string"}},"type":"object"},"method":{"default":"POST","description":"HTTP method the webhook accepts","enum":["GET","POST","PUT","PATCH"],"type":"string"},"path":{"description":"URL path the runtime listens on (e.g. /webhook/orders)","examples":["/webhook/orders","/hooks/slack-event","/api/intake"],"type":"string"},"signature_validation":{"description":"Optional HMAC signature check applied to the request body","properties":{"algorithm":{"default":"hmac-sha256","enum":["hmac-sha256","hmac-sha1"],"type":"string"},"header":{"examples":["X-Hub-Signature-256","X-Slack-Signature"],"type":"string"},"secret_ref":{"description":"Secret name holding the signing key","type":"string"}},"type":"object"}},"required":["method","path"],"type":"object"},"icon":"webhook","label":"Webhook Trigger","output_ports":[{"label":"Triggered","name":"default"},{"label":"Auth failed","name":"rejected"}],"type_id":"trigger"}],"tools":[{"export":"greentic:extension-design/tools.invoke-tool","name":"validate_webhook_config"},{"export":"greentic:extension-design/tools.invoke-tool","name":"suggest_path"},{"export":"greentic:extension-design/tools.invoke-tool","name":"infer_auth_from_curl"}]},"engine":{"extRuntime":"^0.1.0","greenticDesigner":">=0.6.0"},"kind":"DesignExtension","metadata":{"author":{"email":"team@greentic.ai","name":"Greentic"},"description":"Ships the canonical webhook trigger nodeType plus three design-time tools (validate_webhook_config, suggest_path, infer_auth_from_curl). Webhook is operator-side ingress — the runtime exposes an HTTP listener, validates auth, and kicks off flow execution when a request matches the configured path. The tools help the designer LLM produce a valid trigger config from natural-language intent or a sample curl an upstream system would send.","id":"greentic.webhook","keywords":["webhook","trigger","ingress","http","design-extension"],"license":"MIT","name":"Webhook Trigger","repository":"https://github.com/greenticai/components-public","summary":"Generic inbound HTTP webhook trigger for Greentic flows","version":"1.2.0"},"runtime":{"component":"extension.wasm","memoryLimitMB":16,"permissions":{"callExtensionKinds":[],"network":[],"secrets":[]}},"signature":{"algorithm":"ed25519","publicKey":"66L1j2dtYwoRQ2R6Bt8qkshdZmdb2IW8lLRgibxAI60=","value":"+ZjINs43YQPS1KNi85SHK+BodxzbsJ6Hb3jnZegZse/5mDzSZPFyi9zYnNVDVClwg+TNqm2ZnGlWraOLuJ8vAg=="}}