{"apiVersion":"greentic.ai/v1","capabilities":{"offered":[{"id":"greentic:messaging/email-mailbox","version":"0.1.0"}],"required":[]},"contributions":{},"engine":{"extRuntime":"^0.1.0","greenticDesigner":"*"},"kind":"ProviderExtension","metadata":{"author":{"email":"team@greentic.ai","name":"Greentic"},"icon":"assets/icon.svg","id":"greentic.provider.email","license":"MIT","name":"Email","summary":"Email messaging provider (SMTP send + IMAP receive)","version":"1.2.3"},"runtime":{"component":"extension.wasm","gtpack":{"component_version":"0.6.0","file":"runtime/provider.gtpack","pack_id":"greentic.provider.email","sha256":"c47ee69a5c8f9eb03630c73b111b12381361f253adc264a3686fc8cb07792761"},"memoryLimitMB":32,"permissions":{"callExtensionKinds":[],"network":[],"secrets":[]}},"signature":{"algorithm":"ed25519","publicKey":"66L1j2dtYwoRQ2R6Bt8qkshdZmdb2IW8lLRgibxAI60=","value":"zcp5PtC1LbrOq/zSyvDpulKjPnjqb0+Zr8TlyVx43jgJwOUcGMeIoRk19fyxTkaXBt9oBQf2bNo/BrbCHHRTBQ=="}}