{"$schema":"https://store.greentic.ai/schemas/describe-v1.json","apiVersion":"greentic.ai/v1","capabilities":{"offered":[{"id":"greentic:platform/bootstrap-nodes","version":"1.0.0"}],"required":[]},"contributions":{"nodeTypes":[{"category":"trigger","color":"#475569","complexity":"simple","config_schema":null,"icon":"🚩","label":"Start","output_ports":[{"label":"Next","name":"default"}],"type_id":"start"}]},"engine":{"extRuntime":"^0.1.0","greenticDesigner":">=0.6.0"},"kind":"DesignExtension","metadata":{"author":{"email":"team@greentic.ai","name":"Greentic"},"description":"Ships the start nodeType — the only structural primitive the platform itself owns. Webhook trigger moved to `greentic.webhook` in 0.2.0; the generic LLM nodeType moved to `greentic.llm-generic` in 0.3.0. Other extensions specialise these over time — provider extensions can register their own trigger types (slack-trigger, teams-trigger, …) and llm-specific extensions can register typed LLM nodes (greentic.llm-openai, …) — but the editor always has a baseline. Pure metadata extension: no tools, no schemas, no prompts, no knowledge.","id":"greentic.platform-bootstrap","keywords":["platform","bootstrap","node-types","design-extension"],"license":"MIT","name":"Greentic Platform Primitives","repository":"https://github.com/greenticai/components-public","summary":"Canonical node-type descriptors for editor primitives the platform itself owns","version":"1.2.0"},"runtime":{"component":"extension.wasm","memoryLimitMB":16,"permissions":{"callExtensionKinds":[],"network":[],"secrets":[]}},"signature":{"algorithm":"ed25519","publicKey":"66L1j2dtYwoRQ2R6Bt8qkshdZmdb2IW8lLRgibxAI60=","value":"3EGopEg8M0KRVlvKUkhmZZUNX670NaT1SYY9J4/PMyoGtX7K3+jkuPrU4xt4wxA9+JSmXWW9fzBq+lBo12rYDA=="}}