{"apiVersion":"greentic.ai/v1","capabilities":{"offered":[{"id":"greentic:messaging/telegram-direct","version":"0.1.0"}],"required":[]},"contributions":{},"engine":{"extRuntime":"^0.1.0","greenticDesigner":"*"},"kind":"ProviderExtension","metadata":{"author":{"email":"team@greentic.ai","name":"Greentic"},"icon":"assets/icon.svg","id":"greentic.provider.telegram","license":"MIT","name":"Telegram","summary":"Telegram Bot API messaging provider","version":"1.2.3"},"runtime":{"component":"extension.wasm","gtpack":{"component_version":"0.6.0","file":"runtime/provider.gtpack","pack_id":"greentic.provider.telegram","sha256":"1fca9d71b9147e89be603676331ffacdabe11721d78d03391f9c84ba85210efe"},"memoryLimitMB":32,"permissions":{"callExtensionKinds":[],"network":[],"secrets":[]}},"signature":{"algorithm":"ed25519","publicKey":"66L1j2dtYwoRQ2R6Bt8qkshdZmdb2IW8lLRgibxAI60=","value":"kzHgMo7qQctC1SPHl+aHPtNroNhsOPOjag+H1YV75OtoAxr7cV3cPm8n4XeHZYlneSEI379vOmyBFT8nbhnICw=="}}