{"apiVersion":"greentic.ai/v1","capabilities":{"offered":[{"id":"greentic:deploy/aws-ecs-fargate","version":"0.1.0"}],"required":[]},"contributions":{"targets":[{"description":"Deploy to AWS ECS+Fargate+ALB via Terraform using ambient AWS credentials","displayName":"AWS ECS Fargate (local Terraform)","execution":{"backend":"aws","handler":null,"kind":"builtin"},"id":"aws-ecs-fargate-local","supportsRollback":true}]},"engine":{"extRuntime":"^0.1.0","greenticDesigner":"*"},"kind":"DeployExtension","metadata":{"author":{"email":"team@greentic.ai","name":"Greentic"},"icon":"assets/icon.svg","id":"greentic.deploy-aws","license":"MIT","name":"AWS Deploy","summary":"AWS ECS Fargate deployment via Terraform","version":"1.2.0"},"runtime":{"component":"extension.wasm","memoryLimitMB":32,"permissions":{"callExtensionKinds":[],"network":[],"secrets":[]}},"signature":{"algorithm":"ed25519","publicKey":"66L1j2dtYwoRQ2R6Bt8qkshdZmdb2IW8lLRgibxAI60=","value":"wC2kJBun+VyeIkQVRANOI9rxwH21TzUM6wfo/N0STRuJ0aeCCEqC0U+pHkJBXfyGb5NUjGGjHRk9aiIfkpS0Bw=="}}