{"apiVersion":"greentic.ai/v1","capabilities":{"offered":[{"id":"greentic:deploy/gcp-cloud-run","version":"0.1.0"}],"required":[]},"contributions":{"targets":[{"description":"Deploy to GCP Cloud Run via Terraform using ambient Google credentials","displayName":"GCP Cloud Run (local Terraform)","execution":{"backend":"gcp","handler":null,"kind":"builtin"},"id":"gcp-cloud-run-local","supportsRollback":true}]},"engine":{"extRuntime":"^0.1.0","greenticDesigner":"*"},"kind":"DeployExtension","metadata":{"author":{"email":"team@greentic.ai","name":"Greentic"},"icon":"assets/icon.svg","id":"greentic.deploy-gcp","license":"MIT","name":"GCP Deploy","summary":"GCP Cloud Run deployment via Terraform","version":"1.2.0"},"runtime":{"component":"extension.wasm","memoryLimitMB":32,"permissions":{"callExtensionKinds":[],"network":[],"secrets":[]}},"signature":{"algorithm":"ed25519","publicKey":"66L1j2dtYwoRQ2R6Bt8qkshdZmdb2IW8lLRgibxAI60=","value":"PeXvm+rp7ti6TWhRuAm71evJkeOQCEmn6UN1jfi7rt33vkMbdltyRMeUOhyCF8w0Q4SV5FhBoKoZzYq+5lDaCg=="}}