{"apiVersion":"greentic.ai/v1","capabilities":{"offered":[{"id":"greentic:deploy/azure-container-apps","version":"0.1.0"}],"required":[]},"contributions":{"targets":[{"description":"Deploy to Azure Container Apps via Terraform using ambient Azure credentials","displayName":"Azure Container Apps (local Terraform)","execution":{"backend":"azure","handler":null,"kind":"builtin"},"id":"azure-container-apps-local","supportsRollback":true}]},"engine":{"extRuntime":"^0.1.0","greenticDesigner":"*"},"kind":"DeployExtension","metadata":{"author":{"email":"team@greentic.ai","name":"Greentic"},"icon":"assets/icon.svg","id":"greentic.deploy-azure","license":"MIT","name":"Azure Deploy","summary":"Azure Container Apps deployment via Terraform","version":"1.2.0"},"runtime":{"component":"extension.wasm","memoryLimitMB":32,"permissions":{"callExtensionKinds":[],"network":[],"secrets":[]}},"signature":{"algorithm":"ed25519","publicKey":"66L1j2dtYwoRQ2R6Bt8qkshdZmdb2IW8lLRgibxAI60=","value":"9VlBcigPbKk+8R6nVeUKDlFjxjLADCEG0cgcgztvKU6spVPud30i+OE/ehG4bWyJLyBpAvvtr2MHDcyyiFyQDw=="}}