{"apiVersion":"greentic.ai/v1","capabilities":{"offered":[{"id":"greentic:deploy/single-vm-systemd","version":"0.1.0"}],"required":[]},"contributions":{"targets":[{"description":"SSH into a Linux VM, install systemd units, run container(s) under docker or podman","displayName":"Single VM (systemd + container runtime)","execution":{"backend":"single_vm","handler":null,"kind":"builtin"},"id":"single-vm-systemd","supportsRollback":true}]},"engine":{"extRuntime":"^0.1.0","greenticDesigner":"*"},"kind":"DeployExtension","metadata":{"author":{"email":"team@greentic.ai","name":"Greentic"},"icon":"assets/icon.svg","id":"greentic.deploy-single-vm","license":"MIT","name":"Single VM Deploy","summary":"Deploy to a single Linux VM via systemd units and a container runtime","version":"1.2.0"},"runtime":{"component":"extension.wasm","memoryLimitMB":32,"permissions":{"callExtensionKinds":[],"network":[],"secrets":[]}},"signature":{"algorithm":"ed25519","publicKey":"66L1j2dtYwoRQ2R6Bt8qkshdZmdb2IW8lLRgibxAI60=","value":"P4Xt8AgkY4uR7G03budnLruSJcpE6LWD+1kgCOkXsLaq+Vc9Yw6B0juXI6zvQpYkSLmfunaUaliRGI/DTWS2Cw=="}}