{"$schema":"https://store.greentic.ai/schemas/describe-v1.json","apiVersion":"greentic.ai/v1","capabilities":{"offered":[{"id":"greentic:llm/generic-step","version":"1.0.0"}],"required":[]},"contributions":{"nodeTypes":[{"category":"ai","color":"#a855f7","complexity":"complex","config_schema":{"properties":{"max_tokens":{"description":"Maximum number of tokens to generate","minimum":1,"type":"integer"},"model":{"default":"claude-haiku-4-5","description":"Model id (e.g. claude-haiku-4-5, gpt-4o, llama3:8b)","examples":["claude-haiku-4-5","gpt-4o","gpt-4o-mini","llama3:8b"],"type":"string"},"system":{"description":"System prompt","format":"textarea","type":"string"},"temperature":{"description":"Sampling temperature. 0 is deterministic, higher values increase diversity. Common range 0–2 depending on the provider; check your model's docs for valid bounds. Leave unset to use the provider default.","type":"number"}},"required":["model"],"type":"object"},"icon":"brain","label":"LLM","output_ports":[{"label":"Next","name":"default"},{"label":"Error","name":"error"}],"type_id":"llm"}],"tools":[]},"engine":{"extRuntime":"^0.1.0","greenticDesigner":">=0.6.0"},"kind":"DesignExtension","metadata":{"author":{"email":"team@greentic.ai","name":"Greentic"},"description":"Ships the canonical generic `llm` nodeType — a fallback for prompt-driven AI steps that aren't pinned to a specific provider. Provider-specific extensions (greentic.llm-openai and friends) ship richer nodeTypes that implement the actual completion call; this generic node is a placeholder the planner can target when the provider is unknown or pluggable. Pure metadata extension: no WASM logic, only the descriptor + JSON Schema the designer needs to render the inspector form.","id":"greentic.llm-generic","keywords":["llm","ai","generic","design-extension"],"license":"MIT","name":"LLM (generic)","repository":"https://github.com/greenticai/components-public","summary":"Generic LLM step node for Greentic flows","version":"1.2.0"},"runtime":{"component":"extension.wasm","memoryLimitMB":16,"permissions":{"callExtensionKinds":[],"network":[],"secrets":[]}},"signature":{"algorithm":"ed25519","publicKey":"66L1j2dtYwoRQ2R6Bt8qkshdZmdb2IW8lLRgibxAI60=","value":"foOrY+aXpxXQkXO9FC6jm/hKPek7xCKQnorm33dYkLLPHCxk20SVJnGPwJKNGixTbdJJVCfwoxmvayIz8hk1Aw=="}}