{"apiVersion":"greentic.ai/v1","capabilities":{"offered":[{"id":"greentic:messaging/slack-dm","version":"0.1.0"},{"id":"greentic:messaging/slack-channel","version":"0.1.0"}],"required":[]},"contributions":{},"engine":{"extRuntime":"^0.1.0","greenticDesigner":"*"},"kind":"ProviderExtension","metadata":{"author":{"email":"team@greentic.ai","name":"Greentic"},"description":"Slack messaging provider supporting DMs and channel posts via Block Kit","icon":"assets/icon.svg","id":"greentic.provider.slack","keywords":["messaging","slack","block-kit"],"license":"MIT","name":"Slack","summary":"Slack messaging provider (Web API + Events API + Block Kit)","version":"1.2.3"},"runtime":{"component":"extension.wasm","gtpack":{"component_version":"0.6.0","file":"runtime/provider.gtpack","pack_id":"greentic.provider.slack","sha256":"1b8a08bcafcbb9ee6ef95fdb57eaf32ddedad7782bfcefd074615f060d4ae4d5"},"memoryLimitMB":32,"permissions":{"callExtensionKinds":[],"network":[],"secrets":[]}},"signature":{"algorithm":"ed25519","publicKey":"66L1j2dtYwoRQ2R6Bt8qkshdZmdb2IW8lLRgibxAI60=","value":"Lm5qGPKAoDJBdS9VicYPWSSBFhPC6JcBTK5UcxnflR37B3JskapRDv8pw9iIpG4nyU3axF/BA/vU/NGr/GhdDQ=="}}