{"apiVersion":"greentic.ai/v1","capabilities":{"offered":[{"id":"greentic:messaging/webchat-direct-line","version":"0.1.0"}],"required":[]},"contributions":{},"engine":{"extRuntime":"^0.1.0","greenticDesigner":"*"},"kind":"ProviderExtension","metadata":{"author":{"email":"team@greentic.ai","name":"Greentic"},"icon":"assets/icon.svg","id":"greentic.provider.webchat","license":"MIT","name":"WebChat","summary":"Greentic WebChat Direct Line server provider","version":"1.2.3"},"runtime":{"component":"extension.wasm","gtpack":{"component_version":"0.6.0","file":"runtime/provider.gtpack","pack_id":"greentic.provider.webchat","sha256":"39ebfd1d7bdf9d55d70be74e86e9a81b81ee573a73c17b5e9b0fb8368a2b888b"},"memoryLimitMB":32,"permissions":{"callExtensionKinds":[],"network":[],"secrets":[]}},"signature":{"algorithm":"ed25519","publicKey":"66L1j2dtYwoRQ2R6Bt8qkshdZmdb2IW8lLRgibxAI60=","value":"dXezp9uBk2iGYzwCjZYe3xzZ3yKDDS1/OUIAdppm+/O5K8RGaKPPez4Z4z2JcnhAGKppdaGt2+fmNt5D79OhCw=="}}