{"apiVersion":"greentic.ai/v1","capabilities":{"offered":[{"id":"greentic:messaging/whatsapp-business","version":"0.1.0"}],"required":[]},"contributions":{},"engine":{"extRuntime":"^0.1.0","greenticDesigner":"*"},"kind":"ProviderExtension","metadata":{"author":{"email":"team@greentic.ai","name":"Greentic"},"description":"WhatsApp Business Cloud API messaging provider with template + free-form support","icon":"assets/icon.svg","id":"greentic.provider.whatsapp","keywords":["messaging","whatsapp","meta","business-api"],"license":"MIT","name":"WhatsApp","summary":"WhatsApp Business Cloud API messaging provider","version":"1.2.3"},"runtime":{"component":"extension.wasm","gtpack":{"component_version":"0.6.0","file":"runtime/provider.gtpack","pack_id":"greentic.provider.whatsapp","sha256":"255f198eddd7618d66ff3974d398e495fdf82e8208ccea2470f7bb86a649943c"},"memoryLimitMB":32,"permissions":{"callExtensionKinds":[],"network":[],"secrets":[]}},"signature":{"algorithm":"ed25519","publicKey":"66L1j2dtYwoRQ2R6Bt8qkshdZmdb2IW8lLRgibxAI60=","value":"rB1FrPt3+FkmlZ60gbp7cd9GnvTs1BgQZIkvXGX+aB0i70azihOhvp5vSM8rxtinC1eMkusNHUJfk7GkggFCBw=="}}